,country,description,designation,points,price,province,variety
132422,Greece,"A single vineyard wine with plenty of oak nuances, this shows darker flavors than other Agiorgitikos: Blueberry mixes with the telltale cherry, while vanilla caresses the whole. Strong tannins envelop a medium-bodied wine with good acidity, while the nose offers supple blackberry and blueberry fruit, vanilla and some meaty notes.",Ammos,88,35,Nemea,Agiorgitiko
132602,Greece,"A refreshing nose of menthol, cloves, spice and cherry lead this alluring red. Soft, integrated flavors of cherry, vanilla, forest berries and pepper follow. Gentle tannins and an overall classic character add to its pretty appeal. An elegant sip.",,87,19,Nemea,Agiorgitiko
132622,Greece,"This fruitier-style Agiorgitiko has an approachable, versatile character. On the nose, blackberry, cinnamon, spice and red berries lead, followed by a balance of fruit and dry spice on the palate. Balanced but has an earthy spin that speaks of its origins. A great go-to red.",Notios Red,87,13,Peloponnese,Agiorgitiko
132904,Greece,"Blueberry, pepper and cedar aromas and flavors dominate in this structured, elegant red. The wine finishes long with spice and dark cherry notes. A collectible wine that will pair well with poultry, game.",Reserve,87,40,Arcadia,Agiorgitiko
134078,Greece,"Sweet cedar and cinnamon aromas and flavors of tart red cherry, vanilla and savory spice give this wine extra kick. It's still soft and integrated though—a dry and spicy but gentle red that has class.",Megapanos,86,28,Nemea,Agiorgitiko
134381,Greece,"Ripe cherry, cedar, vanilla and spice aromas are followed by soft red berries, cinnamon and vanilla flavors in this appealing Cabernet/Agiorgitiko blend. Overall soft and rich, the wine has a chalky, clean finish and a spin of spice.",Red Stag,86,15,Nemea,Agiorgitiko
134678,Greece,"A soft nose of juicy berry, spicebox and a touch of flowers lead this elegant red. On the palate, tobacco, clove, red berries and spice flavors are balanced and ageable. This is still a dry style of red that goes well with spicy food.",Agiorgitiko by Gaia,86,18,Nemea,Agiorgitiko
134989,Greece,"This earthy red starts with aromas of leather, cherry and dried fruit, followed by spicy pepper, leather and a touch of barnyard on the palate. Unfolding and interesting, the wine will open up with food—think red meat, game.",,85,25,Nemea,Agiorgitiko
135050,Greece,"A simple, Beaujolais-like nose of purple fruit, grass and earth leads to an equally simple palate with a nice, smooth feel. Cinnamon and brown spice emerge from grapey flavors while a mineral streak runs through the middle.",Agiorgitiko,84,20,Nemea,Agiorgitiko
135289,Greece,"This subtle, elegant sip starts with aromas of spicebox, tobacco and rich dark fruit, followed by flavors of cherry, cedar and cinnamon spice. A softer style, integrated red that will pair well with duck, steak.",Réserve,85,45,Nemea,Agiorgitiko
135873,Greece,"This refreshing red starts with aromas of allspice, clove, mint and red berries, followed by flavors of tobacco, clove and cherry on the palate. A wine with some elbows, it could age for 3-5 more years. Pair with grilled meats.",Argilos,84,14,Nemea,Agiorgitiko
135915,Greece,"Cherry and cinnamon emerge from darker flavors of purple fruit and a hint of barnyard, while the hard tannins outweigh this wine's medium body.",Nemea,83,14,Nemea,Agiorgitiko
136201,Greece,"The color is in the rust-salmon family. Aromas are of cherry and rose, while the fairly lively palate has more rustic flavors of cola and cherry fruit.",Demestica Rosé,82,9,Greece,Agiorgitiko
136503,Greece,Freshly crushed raspberry and darker red fruit aromas waft from this deeply colored rosé. The wine has light tannins but lacks the acidity to lift the dark pomegranate flavors.,Agiorgitiko (St. George) Rosé,81,14,Corinth,Agiorgitiko
137600,Greece,"Aged four months in oak, this supple red offers notes of plum, cherry, forest fruit and a touch of smoke on the nose, and on the palate, a medium-bodied array of spicy and rich berry flavors. Balanced acidity and a lingering finish give the wine extra elegance. A good food wine; pair with grilled lamb, steak.",Mythic River,86,13,Nemea,Agiorgitiko
140608,Greece,"The nose first offers suede and leather before showing some plummy aromas. Smooth tannins give it a refined feel, although the acids keep it on the racy side. Has nice, deep cassis flavor with a touch of cola and spice from oak.",Grande Cuvée,87,25,Nemea,Agiorgitiko
140924,Greece,"So smooth and creamy. Solid oaking leads to polished tannins and flavors of cola and vanilla. The nose is Pinot-esque, while berry and plum flavors hold their own. A good rendition of the Agiorgitiko grape.",,87,25,Nemea,Agiorgitiko
141461,Greece,"This rustic red starts with a nose of red berry, vanilla, pepper and mocha, followed by a full body of spicy dark chocolate, forest fruits and pepper. Pair with grilled meats.",Mythic River,83,13,Nemea,Agiorgitiko
141493,Greece,"This wine has a simple mouthfeel, but plump cherry flavors make up for it. Herbal notes and aromas of cola and green bean keep it from being too straightforward.",Danielis,85,10,Greece,Agiorgitiko
141786,Greece,"A Beaujolais-like nose of raspberry and clay leads to a fruity wine with blueberry and raspberry and a streak of minerality. Only 5% Cabernet, it has a medium-full body supported by good tannins, finishing with tart red fruit.",Saint George-Cabernet Sauvignon,85,8,Peloponnese,Agiorgitiko
141792,Greece,"Young and grapy, with aromas of peanut and sawdust. This wine is decently structured, with young, chalky tannins supporting a medium body. Blackberry flavors add a hint of sweetness, and there are hints of holiday spice and nettles. May improve in a year.",Areti Red,85,18,Greece,Agiorgitiko
141806,Greece,"If you could coat purple grapes in peanut dust, you would know what this wine smells like. A strong minerally-clay element runs through the wine, joined by purple fruit flavor and hickory smoke. Solid tannins and a smooth feel round it out.",Agiorgitiko (St. George),85,14,Peloponnese,Agiorgitiko
142091,Greece,"Cinnamon, spice and red berry aromas are touched with coffee. Light flavors of root beer and red berry meet hints of spice. Structured for easy drinking with a smooth cola finish, this is a wine you could chill a bit and have with smoked meats.",Red,85,9,Nemea,Agiorgitiko
142630,Greece,"Fuller-bodied than many Agiorgitikos, this has tart, mixed berry flavors with cinnamon and spice on the nose. A bit rustic, but nobody will mind the strawberry-flavored finish.",Saint George,84,13,Nemea,Agiorgitiko
142901,Greece,"Red berry and cinnamon aromas start off this wine, and it has racy red fruit in the mouth. A bit rustic, but nice.",Rubis,83,10,Greece,Agiorgitiko
143213,Greece,"Rosy color hints at the lightness of this wine, while sweet red fruit and spice flavors pair with gym bag aromas.",Demestica Red,81,9,Greece,Agiorgitiko
