,country,description,designation,points,price,province,variety
144,US,"Clean, sharp and zesty fruit blossom aromas meet with ripe pomelo and green apple scents on the nose of this wine by Steve Dooley. A fresh, tingling acidity shows on the sip, which is a tad sour with stone fruit skins but bountiful in a slate-driven minerality and grippy texture. Cool climate Albariño has much promise in the state.",Jespersen Ranch,90,24,California,Albariño
147,Spain,"Aromas of white flowers, stone fruits and lees are typical of well-made Albariño. A juicy, elegant palate with a mix of citrus and stone-fruit flavors is lasting, with a hint of pithy character coming up on the finish.",,90,17,Galicia,Albariño
333,Spain,"Lightly leesy aromas of vanilla cookie are offset by crisp minerally apple and stone-fruit scents. This is pure and lifted by fine acidity, while flavors of apple, pineapple and lemon-lime end fresh, with a distant note of citrus pith. Drink immediately.",Etiqueta Ambar,91,22,Galicia,Albariño
376,US,"Not such a rarity these days, Albariño is turning heads in California and Oregon. This tart, juicy, and deliciously fresh effort is loaded with tangy citrus and green apple fruit. It's leesy and textural, tasting of wet stones: in sum, a wonderfully refreshing summer white.",,90,18,Oregon,Albariño
395,Spain,"Apple, lime and mineral aromas lend freshness to a mature nose. This feels round and plump, but well balanced due to fine acidity. Peach and citrus flavors are stony and finish with tropical notes of lychee and mango. Drink now.",Albariño de Fefiñanes,90,26,Galicia,Albariño
506,Spain,"Look for the blue bottle and you'll get a solid Albariño. This is typically light and fresh, with aromas of stream water, wild flowers, fresh herbs and leesy stone fruits. Crisp and citric on the palate, with proper cut, this tastes of orange, peach, nectarine and lemon. Minerally, cleansing and steady on the finish.",Val do Salnés,89,25,Galicia,Albariño
641,Spain,"Classic Albariño aromas of sea brine, tropical fruits, lees and dust precede a minerally lemony palate with tangy flavors of lemon, lime and gooseberry. This is a fresh clean example with a long stony citrusy finish.",Sin Palabras Castrovaldés,90,20,Galicia,Albariño
1966,Spain,"Apple, peach and melon aromas are fresh and easy to like. This has a pure palate, with citric and malic acidity offset by pulpy weight. Peach and apricot flavors finish long, and overall this should maintain its good shape over the next year.",,88,16,Galicia,Albariño
2235,US,"Bone dry and tart, this is made without oak, allowing the grape's natural acidity and flavors to star. There's a minerality to the lemons and limes, with hints of vanilla and white pepper. What a glorious partner for oysters on the half shell.",,90,20,California,Albariño
2650,Spain,"Dusty, melony aromas hint at the tropical end of the aromatic spectrum. This is predominantly austere in feel, with a touch of leesy weight. Lemon, pineapple and mango flavors end with general softness propped up acidic cut. Drink immediately.",Davila,89,18,Galicia,Albariño
2936,US,"It's hard to believe there's no oak on this wine, with its accents of vanilla and buttered toast. The wine was fermented in stainless steel and bottled earlywith no barrel exposure. It's beautifully rich in tropical fruit, pear, peach and lime flavors, with a brisk amount of acidity.",Don Miguel Vineyard Estate Grown & Bottled Unfiltered,90,32,California,Albariño
3024,Spain,"Bright, moderately complex aromas of stone fruits and minerals precede a firm, lemony palate with familiar, highly fresh tangerine and nectarine flavors. This holds its form and snap on the finish. Drink during 2016.",,89,17,Galicia,Albariño
3206,US,"Aromatic and quite fruity, this offers flavors of peach, candied lemon and orange marmalade. It's fully dry, but all that fruit gives it a roundness missing from steelier Spanish versions.",,88,21,Oregon,Albariño
3257,Spain,"Friendly familiar aromas of lees, seashell, lemon, melon and apple set up a shearing pointed palate. Flavors of lemon-lime, green apple and gooseberry are propelled by minerally acidity, while the finish is fresh and well cut.",,89,18,Galicia,Albariño
3417,Spain,"Mild, clean aromas of dusty apple, lees and peach set up a creamy, full palate with low acidity and moderate definition. Papaya and melon are the lead flavors, while the finish is melony and oily, with low acidity and not much, if any, minerality.",,87,20,Galicia,Albariño
3721,Spain,"Mild, clean aromas of dusty apple, lees and peach set up a creamy, full palate with low acidity and moderate definition. Papaya and melon are the lead flavors, while the finish is melony and oily, with low acidity and not much, if any, minerality.",,87,20,Galicia,Albariño
4648,Spain,"Apple and stone-fruit aromas are a little oily and starting to fade. Driving acidity keeps this in forward mode, but there's an empty gap in the middle of the palate. Waxy apple, apricot and orange flavors finish just juicy enough. Drink immediately.",Rosa Nautica,88,19,Galicia,Albariño
4671,Spain,"Aromas of orange peel and orange essence are oily and bring softer notes of melon, apple and tropical fruits. This is bright but basic on the tongue, with cutting acidity. Tropical flavors of green melon and mango are ratcheted by citric acidity, while the finish is citrusy and pithy.",,88,20,Galicia,Albariño
5293,Spain,"Aromas of canned peaches and children's vitamins lack appeal. This feels fleshy and far from precise, with a mix of oxidized white-fruit and bitter flavors that leads to a mealy finish.",,83,18,Galicia,Albariño
5779,US,"Fermented and aged in stainless steel without going through malolactic fermentation, this steely, waxy Albarino is ready for tapas, offering big bold tastes of peach and apricot. Textured and long-lasting, its tangible acidity will make seafood, especially shellfish, sing.",,88,18,California,Albariño
6000,Spain,"By nature Albariño doesn't last long, and this is well past its prime. Chunky, mealy, soft aromas announce a fleshy, low-pulse palate with mealy peach flavors and no finish.",,81,15,Galicia,Albariño
6235,Uruguay,"A good example of South American Albariño, this wine shows aromas of leesy buttercup, acacia, vanilla, grassy citrus and apple aromas on the nose. The energetic palate comes on strong with apricot and nectarine flavors which move to nutty and leesy tones on the finish.",,89,25,Montevideo,Albariño
6297,Spain,"A mild bouquet of generic stone-fruit aromas is a touch empty but friendly. This is mild on the palate, with modest acidity and not much minerally kick. Briny, leesy nectarine flavors finish round in feel. Drink immediately.",Andión,86,18,Galicia,Albariño
6468,Spain,"Peach and apple aromas are soft and easy, maybe even a touch cidery. Overall, this is a standard but well-made Albariño, with flavors of nectarine and cider. Drink immediately.",,88,17,Galicia,Albariño
6561,US,"Yellow summer melon and green apple make for a crisp, clean, bright and beautiful nose. The palate is peachy, with a citrus and cinnamon-apple flavored finish, walking the fine, fun line between brisk austerity and fruity richness.",Huerhuero,89,18,California,Albariño
6923,Spain,"Stalky aromas of straw and citrus are challenging but acceptable. On the palate, this is racy and feels like nectarine juice. Leesy, stalky peach flavors finish floral and yeasty, with lasting acidity. Drink immediately.",Legado del Fraile,86,15,Galicia,Albariño
7072,Spain,"Leesy, cheesy aromas fall apart as this struggles a bit to present a clean front side. Almost dilute in feel, this tastes of cidery apple, nectarine and lees. On the finish, a hint of popcorn rises up.",,87,25,Galicia,Albariño
7394,Spain,"A positive bouquet of melon, white flowers and honey leads to a ripped acidic palate that generates tangy, almost sharp flavors of orange and gooseberry. A citrusy angular finish turns pithy and bitter as it dissipates. Drink now.",,87,18,Galicia,Albariño
7670,US,"There's a seltzer quality to the nose of this wine, with aromas of pink-grapefruit spritz, apple and pear cider, and fresh baking soda. It's tight and grippy on the palate, with flavors of green-apple flesh and tangerine skin that linger into the finish.",,87,24,California,Albariño
7728,Spain,"Floral leesy aromas of chunky stone fruits and citrus come with a green note of lettuce leaf. This feels round and a touch oily, while briny mildly bitter flavors of citrus finish pithy.",Pazo Barrantes,87,20,Galicia,Albariño
7813,US,"There's a seltzer quality to the nose of this wine, with aromas of pink-grapefruit spritz, apple and pear cider, and fresh baking soda. It's tight and grippy on the palate, with flavors of green-apple flesh and tangerine skin that linger into the finish.",,87,24,California,Albariño
7901,Spain,"Aromas of lees and buttercup come with a hint of tropical fruit. This fading, Albariño is plump and generic in feel, without much cut or minerality. Melon, apple and pithy citrus flavors finish similarly, with mild bitterness.",,85,22,Galicia,Albariño
8183,Spain,"Modest white-fruit aromas share space on the nose with seashell and briny notes. This feels tight and moderate in depth. Flavors of lemon and tangerine are mild, while this loses some clarity on the finish.",,87,17,Galicia,Albariño
8268,Spain,"Fresh stony apple and citrus aromas are composed. Following that lead, this feels focused and fresh. Flavors of stone fruits, citrus fruits and white pepper finish crisp but not real long or deep.",,89,19,Galicia,Albariño
8311,Spain,"Dusty, clammy, white fruit aromas are generic. This is pulpy in feel with a vague focus. Leesy, pithy citrus flavors are standard and short on personality, while this finishes adequately with a mild citric lift.",,87,17,Galicia,Albariño
8329,Spain,"Don't let the gold color fool you, this is quite vital with floral, leesy, almost grassy aromas. Bracing acidity is at the core with clover, grass, quince and sour-apricot flavors. Blasting acidity is a force on the finish.",Pazo Cilleiro,87,20,Galicia,Albariño
8429,Spain,"Round, creamy apple aromas open things up. This is melony and soft in feel, with flavors of cider, lemon and lychee. A tropical-leaning finish is solid but suggestive of a wine in decline. Drink immediately.",Andión,86,16,Galicia,Albariño
8579,Spain,"Briny, pickled aromas come with hints of citrus and flower blossom. This fast-aging Albariño is melony in feel, but it lacks the variety's patented kick and acidity. As a result, peach and apricot flavors are fleshy and chunky.",Columna,84,17,Galicia,Albariño
8638,Spain,"Stony peach and mandarin orange aromas are touched up by a note of white licorice gumdrop on this well-cut, finesse-filled Albariño. In the mouth, an elegant dance ensues between minerality, lees notes and citric acidity. Flavors of apricot, peach and melon finish minerally and with a slow but steady fade. Drink through 2016.",Etiqueta Ambar,92,24,Galicia,Albariño
8870,Spain,"Peachy aromas are less than perky, while in the mouth this is lemony, narrow and citric. Flavors of lemon and tangerine finish with stony mineral notes but also a drawing citric acidity.",Baladiña,86,16,Galicia,Albariño
9268,Spain,"Ideal Albariño aromas of buttercup, orange blossom, mild citrus, peach and seashell set up a mature but fresh palate, with layered complexity and minerality to spare. Flavorwise, this is a touch waxy, with an emphasis on pear, peach and melon. A dry, clean, slightly dusty finish sends this off in fine fashion.",,91,40,Galicia,Albariño
9338,Spain,"Aromas of ocean breeze and white clover are raw but good. This feels round, pulpy and citrusy, with green slightly bitter flavors of citrus, honey and brine. Acidity plays a big role in keeping this afloat. Drink immediately.",Peitán,86,15,Galicia,Albariño
9344,Spain,"Match stick and sulfur notes fade into citrus and kiwi on an O.K. nose. Kind of late in its life already, this smells big and pulpy. Apple and bitter-melon flavors finish citrusy. Drink immediately.",,86,17,Galicia,Albariño
9647,Spain,"Light lemony aromas are more blowsy than exact. This feels citric and grabby, with oily weight to the palate. Flavors of ripe white grapefruit, nectarine and orange expand but don't evolve on the finish.",,88,22,Galicia,Albariño
9651,Spain,"Aromas of lemon curd and citrus blossom come with a hint of pine. This feels lemony and narrow, with a tight body that's showing little to no give. Nectarine, citrus and green-melon flavors are fresh prior to a dry citrusy finish.",,88,25,Galicia,Albariño
10389,Spain,"Yellow in color, with heavy dusty flat aromas of apple and citrus, this feels low on acidity and thus flat. Cidery apple and lime flavors finish chunky and leesy with an oily texture.",,85,15,Galicia,Albariño
10392,Spain,Dusty apple aromas come with a vanilla-like note of animal crackers. A plump but diluted palate shows mediocre wan flavors of nectarine and apple in front of a flat finish that's losing steam. Drink immediately or wait for a new vintage.,,85,18,Galicia,Albariño
10627,Spain,"Orange peel aromas are a bit stony. In the mouth, this feels like it's past its prime, with little to no intensity or acidity. Mild apple flavors are sweet, mealy and honeyed, while the ending is leesy and mushy.",Family Estate Selection,84,20,Galicia,Albariño
10644,Spain,"An oily bouquet lacks freshness while smelling a bit oxidized and like mushrooms. This has a chunky palate with oxidized, somewhat bitter flavors of papaya and citrus fruits. A pithy mildly bitter finish struggles to show its virtues.",,84,18,Galicia,Albariño
10972,Spain,"Nothing on the bottle says this is oaked, but this Albariño smells like burnt plywood and sawdust. It's chunky and fat on the palate, with woody melony flavors that finish salty and dried out.",,83,20,Galicia,Albariño
10975,Spain,"Mature mealy apricot aromas lead to a spent palate with unfocused cidery flavors that taste old and demanding. This finishes heavy, pulpy and without much point or pleasure. Albariño is meant to be fresh and friendly, but this is neither.",,83,20,Galicia,Albariño
11253,Spain,"Melon, apple and peach pit aromas are dusty but that's about it. This feels flat, with little acidity or kick. Flavors of peach and apple cider end similarly, with no vitality to the finish.",A2O,83,17,Galicia,Albariño
11272,Spain,"Murky mucky passion fruit and pineapple aromas are uncommon and uninviting. This feels watery and a bit citrusy, while strained mango and passion fruit flavors end bitter, pithy and lean.",,82,26,Galicia,Albariño
12355,Spain,"This is a particular style of Albariño. Aromas of white flowers distant mineral and green melon set up a plump, layered palate, with core acidity but also flatness that will only increase the longer it goes. Flavors of nectarine, orange and melon register as citric but also creamy. This is a unique Galician white that's stylish but won't last forever; drink immediately.",Gran Vinum Selección Especial,90,27,Galicia,Albariño
12591,Spain,"Flowery aromas suggest air freshener. This feels plump, round and oily. Salty orange flavors are just ripe enough to be good, while this pushes the limits of brininess on a finish that offers a taste of the ocean.",,87,19,Galicia,Albariño
13288,Spain,"This is a little heavy and oily on the nose, with blowsy white-fruit aromas. It feels peachy and smooth, with key flavor components of melon, apple and pear. This shows some extra heft, ending with a subtle and smooth finish.",O Rosal,89,24,Galicia,Albariño
14130,Spain,"Citrus and apple aromas are fresh, reserved and on the light side. In the mouth, this pops with lemony acidity and related tang. Flavors of tart green apple and lime are racy almost to the point of being sour, while this ends with a tingle of sharp acidity and a sense of wet stones and minerals.",Legado del Conde Albariño,88,16,Galicia,Albariño
15042,Spain,"Waxy melon and apple aromas are intricate and welcoming, while the melon and citrus flavors are just as they should be. Do Ferreiro is a consistent high-end producer in Rias Baixas and its '05 Albariño is great. It picks up steam as it goes along and will go great with salads and seafood. Drink now.",,90,24,Galicia,Albariño
15628,Spain,"Very nice apple blossom and lightly stony aromas greet you, and the apple and apricot flavors are juicy and ripe. This is an all-fruit wine with just enough acidity and minerality to keep it in shape. Finishes with citrus and melon. Drink now.",,89,24,Galicia,Albariño
16691,Spain,"There's not much difference between this wine and the label's less expensive Brandal. This is a bit richer, with chunky melon aromas and peach melba flavors. But it may suffer a bit from additional ripeness and lower acidity. For best results, get at it fast.",,87,25,Galicia,Albariño
16699,Spain,"A little weighty, with ripe apple and peach aromas. Fairly succulent in the mouth, with apple and citrus flavors that are both sweet and a touch chewy. Some pith on the finish adds complexity and overall you can't knock the wine's character. Drink now.",Brandal,87,15,Galicia,Albariño
17136,Spain,"It's already too late for an '04 Albariño, but this one still has some life and kick in it. The nose has some peanut and lacquer, but overall apple aromas ride high. In the mouth, it shows the oily quality of an aging white along with peach, citrus and nut flavors.",,86,18,Galicia,Albariño
19878,US,"The combination of stainless-steel and oak-barrel fermentation has been good for this wine. It's bright and steely in acidity, and lifts the variety's mineral and citrus flavors to new heights, adding a rich level of smoky cream. Just beautiful and versatile at the table, a sommelier's dream wine. Production was a mere 850 cases.",Limited Release,91,22,California,Albariño
20726,Spain,"Just sweet and soft enough to temper the wine's more citric, minerally side. Aromas of green pear and melon are basic and welcoming, while the snappy, forward palate is cleansing and fresh. Flavors of green melon, apple, saline and honey scream Rías Baixas.",Peitán,88,15,Galicia,Albariño
20996,Spain,"One of the most cutting, acid-intense Albariños out there. The nose in minerally and tight as a drum, with green melon and green apple scents. The palate is razor sharp and driving, with tangy, high-toned lemon and Granny Smith apple flavors. Totally citric and zesty; it will last another few years.",,87,26,Galicia,Albariño
21290,Spain,"Aromas of pineapple, grapefruit, juniper berry and dust are slightly sharp but do manage to fold together into a solid whole. The palate is correct, with green-leaning, semiherbal flavors of melon, papaya and mango. A good to above-average Albariño that should be drunk right away.",,87,15,Galicia,Albariño
21331,Spain,"Fairly pungent, with apple and lemon aromas that are typical for the variety. The palate has an edge to it and jacked-up acidity that pushes citrus and pineapple flavors toward tangy. With so much citrus character and acidity, it's lasting and scouring.",Limited Release,87,15,Galicia,Albariño
21875,Spain,"Blowsy and mustardy, like it's starting to turn south. The palate is loud, jumbled and heavy, with mustardy orange flavors, a touch of flowery honey and then bitterness. Big and powerful, but not very poised.",,84,17,Galicia,Albariño
21972,US,"Marimar's first Albariño is unquestionably one of the best ever to hail from California. Made without oak, it's modest in alcohol, giving it a light, transparent mouthfeel that transmits pure, bone dry flavors of peaches, grapefruits and guava, with a touch of Sauvignon Blanc-like gooseberry and enough acidity to make the palate whistle. A real beauty, especially with Asian fusion fare.",Don Miguel Vineyard,92,32,California,Albariño
22580,Spain,"Pretty to sniff, with aromas of lemon, fresh white fruits and minerals. Feels crisp, chiseled and racy, with blazing acidity propelling green apple, lime, green melon and saline flavors. Long on the finish. Drink now.",Pazo Barrantes,89,19,Galicia,Albariño
22998,Spain,"Saline and oceanic on the bouquet, but largely it's neutral-smelling. Feels tight and fresh, but tastes a bit stalky and bitter, with baked apple and a strong taste of straw. Finishes with white pepper notes and that same stalky flavor from before.",,87,20,Galicia,Albariño
23535,Spain,"Waxy and oily on the nose, then narrow as a thin line on the palate. Feels linear and sharp, with lemony flavors that come with a green apple accent. Tastes aged and maderized on the finish, despite displaying lemony acidity and tartness.",El Palomar,84,60,Galicia,Albariño
24898,Spain,"Nice, clean and vibrant, with a welcoming set of peach, apricot and citrusy aromas. The wine is 100% correct and fresh, with clarity and flavors of apple, peach and green grapes. Shows just enough body, acid and pith on the finish, but drink now before it starts to fade.",,89,18,Galicia,Albariño
24950,Spain,"Crisp, clean and minerally on the nose, with apple and green-fruit aromas. It has a round, smooth feel and flavors of peach, apple and citrus that will enliven the palate and aid almost any seafood, vegetable or salad. A natural wine with just enough powdery sweetness to raise a smile.",,89,18,Galicia,Albariño
25156,Spain,"Minerality and crispness define the bouquet, which brings green apple and citrus aromas. There's punch and spritz on the palate as well as sweet citrus and juicy lime flavors that break up a little as they fan out. Not sure if there's residual sugar, but the wine tastes a bit sweet.",,88,16,Galicia,Albariño
25235,Spain,"Crisp and minerally up front, with aromas of apple, peach and dust. It's fresh, maybe a touch basic at its core, with flavors of apple cider, apricot and almond skins. There's nothing not to like about this Albariño, which is pure, pithy on the finish, and more than solid in a pedestrian, familiar sort of way.",Single Vineyard,88,18,Galicia,Albariño
25292,Spain,"Starts out a little gaseous and sulfuric, but it picks up steam in the mouth, where flavors of apricot, citrus and tropical fruits perform a likeable dance. Powerful acidity pushes it in the right direction, and the finish of lychee, passion fruit and nectarine is lasting. Very nice wine but relatively high in price.",,88,25,Galicia,Albariño
25302,Spain,"Stylistically, this is at odds with what I feel Albariño should be. That said, it's a well-executed and well-made barrel-fermented white with full-force toast and popcorn aromas followed by a resiny, vanilla-fueled flavor profile that folds in apple, banana and creamy frosting. Still vital and healthy after three years in bottle.",Nora da Neve,88,29,Galicia,Albariño
25470,Spain,"Neutral aromas suggest peach, apple and minerality. Solid, compact and healthy on the palate, with peach and white pepper flavors. Good on the finish but starting to show some maturity; at peak level now so drink immediately or wait for the 2011.",Sobre Lías,87,18,Galicia,Albariño
25633,Spain,"Fresh smelling, with notes of green melon, apple, honey and minerals. It's more simple than complex, with crisp apple and orange flavors and then a chunky, slightly pithy finish. For under $15 this is good, casual Albariño that won't steer you wrong.",Verdemar,87,14,Galicia,Albariño
26237,Spain,"Opens with peachy, citric and saline aromas. Feels moderately fresh, but seems as though it's starting to mature as it's fleshy and pithy. Flavors of nectarine, orange and bitter pith are good but lack that ethereal quality that can make Albariño special. Drink now.",,85,30,Galicia,Albariño
26268,Spain,"Minerally on the bouquet, with apple and oceanic notes. Turns citric and acidic on the palate, with pineapple, orange and tangy flavors. Shows astringency on the finish, but at least it's juicy and driving.",,85,25,Galicia,Albariño
26325,Spain,"Tight, citric and minerally up front, with less-than-expressive white fruit aromas. Extremely high in acidity, which is why this wine is still kicking. Tastes of tart white grapes and citrus, with zest galore on the finish. 220 cases produced.",Balado,85,60,Galicia,Albariño
26383,Spain,"Peach, melon and light oceanic aromas. Feels a bit flat, with slightly bitter flavors of almond skin and pithy citrus. Picks up steam on the finish courtesy of lasting acidity.",Zios,84,15,Galicia,Albariño
27403,Spain,"Nectarine and apple aromas are good, while this feels plump and melony, but with spine. Briny flavors of gooseberry, apple and orange finish with a note of sea salt. Drink this fresh, minerally wine now.",,88,14,Galicia,Albariño
27584,Spain,"Rubbery, sweaty, muted aromas lead to a dilute, fizzy palate. Prickly green citrus and melon flavors end on the vegetal side.",,84,20,Galicia,Albariño
27711,Spain,"This is a nice value-priced Albariño, with a minerally nose also offers aromas of melon, apple and peach. The palate is citrusy in feel, with lemony acids. Citrus and stone-fruit flavors finish stony and crisp, with a final blast of lemon.",,89,14,Galicia,Albariño
27753,Spain,Minerally peach and apple aromas are typical of the region and variety. A fairly racy palate with good weight brings standard orange and grapefruit flavors prior to a citrusy finish with a touch of pithy bitterness.,Lolo,88,17,Galicia,Albariño
27797,Spain,"Dusty apple, melon and saline aromas are nice but not too intense or exact. This is tight and juicy but textured on the palate, with nectarine, peach and saline flavors. A round feeling finish offers up minerality and length.",,89,20,Galicia,Albariño
